id,Rating,Reviews
2,0,everything read affirmed phone one best dual sim phone market received phone single sim tray returned phone waiting refund went best buy bought phone verifying dual sim tray side needed load app everything work app dual sim connecting computer playing music etc factory like phone better reception last phone couple week still learning
3,1,day battery last whole day rest day 25 impressed
4,1,bueno
5,1,using iphone 12 expecting several hour usage utterly disappointed even 60hz getting usage hour feel nice
6,1,come physical defect like buying one factory problem turn transfering data old phone great price
8,1,expecting phone good like better s22 performance great price thank
11,1,everything
12,1,overall great product received condition promised phone battery however great renewed phone general measure taken last day ideally
14,1,first time buying renewed cellphone tell pre owned look like new cellphone thanks seller accuracy description definitely buy renewed tech
16,1,original review charging port phone received finicky often go back forth e actively charging second charging second back charging although finicky charge 100 hold charge well camera pretty dang good 2 week update charging port barely work noticed bit weird first day got incorrectly assumed much problem worsened pretty quickly point barely charge disappointing phone advertised excellent condition submitted return request ordering replacement receive refund
17,1,far good phone slippery definitely need buy case safely grip phone bought refurbished phone 329 overall happy hopefully get 7 year like previous phone speaker volume phone call quiet
19,1,almost perfect chose excellent option phone scratch back plastic edge look used worn faded color can not change 3g lte 5g option hidden phone restarted browsing setting app screen went black phone restarted everything packaged neatly though survived trip usa 2 stop eu 2 stop africa 2 stop finally ending namibia within 8 day africa took longest included power adapter 10w motorola unit happy everything function except hidden setting one random restart would nice included screen protector case buy
20,0,got phone thought would better phone one unfortunately substandard jack plug headphone sim card place bluetooth speaker low volume phone suck
26,0,amazon described samsung galaxy s21 fe dual sim purchased capability purchased phone phone received single sim complained seller tell single sim plus sim showed phone samsung rep say sim confirmed phone received single sim
30,0,bought phone husband since love samsung product us samsung watch 4 even bought rugged case built screen protector 5 month cellular service always interrupted even resetting network phone back factory setting can not make call receive call email way wi fi cell service cricket problem cricket come occasion service att wi fi good issue service modem cricket customer service show everything working end number show current protocol know wrong told take ir cell phone repair store see may find would cost fix get new one look like purchasing yet another phone husband si make receive call email suck last long phone reason bought one screen lcd screen cracked could fixed
31,1,good phone great camera bought water resistant trouble phone set text message samsung account good really pain battery life adequate paid 288 good value
33,1,say right bat probably way buy phone great deal cheaper happy purchase paid 218 one year old flagship phone selected excellent condition phone came glass screen protector disrupted amoled display removed noticed couple larger scratch imperceptible protector quite according description partially review 4 star issue battery life believe phone running 80 battery health heavy user run phone battery saver activated make full day huge deal samsung battery saver relatively unobtrusive however may opt higher quality renewed phone future overall happy purchase highly recommend process others
34,1,samsung galaxy s21 fe 5g phone received listed excellent surely truly like new condition hint ever used phone came protective plastic file across back side phone always immediately applied screen protector otterbox commuter case sold separately phone shipment quick happy purchase
36,1,excellent condition without scratch screen excessively noticeable work correctly moment would say everything fine
37,1,product good scratch screen work perfectly charger included box original samsung charger 10 watt get hot charging phone aspect phone advertised
47,1,like phone great shape arrived thing come voicemail app phone tell voicemail either
49,0,like fact one piece paper sent show set phone 82 year old next door neighbor model phone would luck sent wrong charger battery 12 per cent getting charged neighbor took phone store young man worked quite helping phone great paper work came wrong charger sent bought right charger store
57,0,bought phone person 1 phone lot scratch 2 sim card reader work unlocked sim card reader working able use sim card would buy understand people sell type trash amazon
60,1,love phone hated fact get info phone damaged reload everything new recover could love phone
64,1,issue put sim ready go thing say phone battery great
66,1,came week earlier expected happy phone gift son like
67,0,ordered samsung galaxy 21 website country work arrived home last week phone package long story short phone work properly make call looked phone determined issue phone seller amazon give refund exchange careful purchase amazon everyone honest unsatisfied customer scam like happening amazon smdh
68,1,love wireless charging feature first time tried phone like new condition day everything seems work well installed compass app handy work like quality mechanical compass thanks great product
70,1,great phone love thing battery little short lived lot review say thing phone spite still love
71,1,phone work great today
74,0,speaker blew failed month getting use speakerphone samsung app store automatically downloads apps without permission whether like could go hour two point alone enough make last samsung device ever
78,1,last ordered iphone 11 renewed got 81 bh like 85 90 close new little scratch cant seen distance time s21 fe complete jackpot man got almost new phone 99 battery health scratch anything complete new problem camera mic audio whatsoever thing ask aware buying renewed phone strictly read rewiews carefully seller different seller phone dont sold less price 235 240 buck option went 240 hit jackpot cause liked 240 seller reputation never regret didnt save money buying former one like average rating always go top rating seller
89,1,product great device owned company controlling allow specific thing make samsung account nothing device amazon product tester truly test product please
93,0,1 called amazon issue amazon told contact vendor vendor show response customer supposed call amazon phone amazon renewed amazon responsible 2 phone supposed unlocked powered showing att logo 3 att phone complained tried insert mobile sim card 4 wireless charging new car intermittent5 wifi calling home work mobile could figure 6 taking picture camera time show camera failed7 cable supplied allow fast charging 9v charging 8 charger heat shuts fast charging phone returned refund hope vendor enjoying seeing 10 phone sell returned
94,1,phone lot scratch screen hook phone good charging good never bought phone used come scratch happy price paid sending old phone back credit amazon account think get said getting back ocd like stuff like say lie stuck afford another one would take picture way believe definitely lying trying make look bad telling truth thank phone last 3 month stop working lately completely ask another sim card work told put old one back work took verizon store tried 2nd sim card work get different phone without phone friday till tues 67 yr old cancer special need son house phone got hold ashamed refund money back taught age people still trusted feel sorry day come someone lie something much cost get money refunded hope one else buy anything
95,1,item arrived well packaged content phone look 100 new happy
96,1,delivered promised condition great able get activated problem
99,1,charge work right box box came delivered damaged inside delivery box would weary ordering amazon renewed phone canadian ordered phone orchard gta got order canada post less 48hrs customer service excellent phone work perfectly recommend first choice
100,0,phone looked worn minor scratch display always issue rest phone lot scratch looked poor condition anticipated ordering renewed renewed phone returned
103,0,phone worked well 45 day
104,1,little skeptical buying renewed phone glad samsung galaxy s20 fe prior one ready upgrade little bit amazing phone far fast run great noticed run little hot time anything super worried come teeny tiny little chip top right corner super hard notice actually took two day realize even nothing really complain considering used phone one small tiny tiny blemish others scratch screen even back definitely recommend buying definitely worth price
106,1,trying pay less top tier phone way bought one poorest condition sure phone scratch case screen protector applied even notice
109,1,estado perfecto sin ningun detalle libre para cualquier compa
111,1,like said excellent condition corner sim card slot scratched phone saying imei empty good right
113,1,good around cellphone bell whistle budget friendly price great travel cell want risk loosing main cell
118,1,said excellent condition nut there pretty decent dent back shell excellent condition set mint service problem transfered everything old phone
120,1,excellent condition glass perfect battery etc delivery ok
122,0,thus samsung galaxy s21 fe 5g phone 5g stated trying 2 different sim card calling carrier tech support said issue phone 5g getting 4g can not get video call
125,0,device compatible visual voicemail contacted samsung told return device took control phone said something wrong software returned
126,1,brought phone one child use phone much far good issue keep eye give update anything arises price good happy purchase
130,1,wanted give thumb seller cuz knew expect phone never know seller def would buy
131,1,reading review phone nervous ordering last phone last leg phone shipped right away arrived time minor scratch edge screen nothing impair function charge great battery power last according usage
132,1,received samsung galaxy mail opened happy said excellent quality almost new meant scratch wonderful refurbishment phone everything remember series galaxy except lack power button one since s9 maybe loop threw little still take away phone though fast wonderful picture quality bunch space adore quality call sound perfect happy purchase
133,1,bought phone want tovget another contract let tell far phone perfect love giys company best phone complaint ever testing could look every angle perfect thats guy dont get expensive contract phone good thank keep good work
141,1,took week get usps arrived excellent condition great phone might want opt express delivery
159,0,received renewed phone expected function one ui manages home screen apps work update app nothing complete factory reset device nothing sent u nonfunctioning phone
164,0,got device worked normal realized mean can not update software battery started get low reason th battery last long finish charging port work
166,1,using phone couple day far issue screen chipped weird warp didnt affect functionality phone far
167,1,good deal happy got little minor blemish really look excellent performer economy
170,0,got two phone seller didnt work said one ui home stopped responding phone dont buy seller
171,1,arrived quickly noticeable scratch mark phone seems work well
189,0,one ui repeatedly crash making phone unusable two device unusable
205,1,phone look new work well month work perfectly must warn esim feature none samsung s21 phone function despite fact samsung say learn hard way otherwise work well good job restoring phone
206,0,mad took metro pc store told u installed oneui app would allow u set
210,1,first thing good packaging everything inside secured ang daming freebiessss sulit tlga kapag pre order already tested unit work well naman pati huawei bud okay
211,1,phone work good unlocked first said needed sim skip step work wit sim
215,1,good phone say dual sim feature spec phone received good condition brought fiji family member issue network single sim phone hope recover cost selling someone else lot hassle send back
219,0,phone say imei number typically due tampering unfortunately find tried update phone noticed updating issue preventing phone updating security patch contacted seller refused help contacted samsung never even seen issue help beware seller selling bad phone knowingly
225,0,got phone work frustrating need phone got day good thing sucked work ship back refund
227,1,bought phone run atak came perfect condition running great
235,0,got order ontime however phone work heat charging charger brick work phone doesnt charge past 50 phone rejecting new charger detecting
254,1,remis neuf
262,1,took time reviewing product ok naman legit seller 2nd purchase already 1st tablet good thing able avail 0 interest spaylater freebie strap long quite big like hubby jist exact wrist kudos sent message delivery somebosy receive upon delivery asked rider said valuable item like protocol send msg first delivery
269,0,hang even restore fabric
272,1,came crack housing near camera light scratch along screen edge one fairly deep quarter inch scratch screen close edge gouge outer housing one bottom corner still 4 star phone work perfectly amazing camera really great graphic processing like playing game
274,0,purchased refurbished phone past without glitch however samsung s21 fe given issue first clip pin take sim tray received broken good thing still one previous phone back phone little scratched battery last long bad battery life
277,0,attempted purchase renewed samsung galaxy 21 see like android compared iphone upon arrival phone looked good shape went setup process completed everything smoothly got home screen application anything display every 3 second screen would go black home screen would reappear phone displayed message stated imei number could found failed read review selecting phone seems others problem phone work buy seller allowed sell product review return addressed
279,0,disappointed purchase phone came late 1 2 wanted dual sim card phone however phone dual sim card slot e sim card slot think make another phone purchase amazon conflicting
284,1,upgrade phone want spend fortune cell phone store exactly needed
286,1,good accommodating seller good ung packaging wrap napaka secured totally recommend seller product keep business going quality time kudos
296,0,medium could loaded bought phone renewed one opened found many scratch damaged frame
298,0,replacement sent u 4 month first one charging poor quality control buy
310,1,bought phone son birthday happy purchase price quality ratio perfect
322,0,bad battery
325,1,best feature okay good performance good super okay good tagal malowbat okay na okay legit thank seller dahil safe nareceive kahit wlaang add cost safe handling
330,0,took provider stated phone black listed can not used returning product
331,0,buy seller selling item work properly
340,0,phone description said excellent condition however scratched casing dented dropped came faulty charging block block heat reason stuck new instead refurbished
341,1,got replace wife galaxy s10e dropped toilet renewed phone couple year newer s10e screen case appear immaculate work fine good battery life happy far
344,0,came decent amount scratch screen bad enough care bluetooth work call speaker work medium moment someone call connected earphone whole screen freeze returning
346,0,cell phone work turn every minute
363,0,received phone tried activate informed verizon lost stolen device list could activated cost two sim card give negative star rating could buyer beware stay far away
366,0,phone looked good powered one ui kept crashing made impossible set called support number find number go support instead nice lady affiliated seller confused keep receiving call cell phone issue
369,0,medium could loaded received phone since able access please description say renewed ui system responding want money back
372,0,phone keep going black one ui response failing main software purchased excellent condition state past test test without seeing happened soon turned phone disappointed amazon gadget something renews sell device happened happened everyone else
373,0,vino defectuoso su software tuve que regresarlo
374,0,running
379,1,phone work like old one great however big disappointment slot micro sd card phone additional storage limited internal 128 mb storage force store cloud
380,0,first phone came setting oneui keep crashing replacement phone delivered thing happening must something incorrect flashing phone amazon renewal department thing would get past loop install launcher like nova launcher making default launcher acceptable though like native oneui thank
390,0,shame
393,1,bought phone husband researched upgrade need anything fancy wanted something middle road free upgrade great first let say screen great condition phone work fine however going list phone refurbished excellent condition come edge worn scratched expected one looked though put wringer least case cover principal listed excellent condition good condition one run 150 00 honestly would hated see good condition looked like excellent standard
394,1,first opening home launcher screen issue downloading another one work perfectly smooth fast price
395,1,smart phone user got solely camera use hiking vacationing wow love zoom quite bit without getting grainy super thrilled
402,1,picture show phone come screen pen
405,1,grandson like
408,0,phone faulty load properly startup trade better device
410,0,bought phone went put sim card recognize metro pc sim ended going metro get new sim found phone blacklisted network due used insurance scam store wanted call cop u till explained situation technically stolen
413,1,item described work great unlocked got great price cheapest could find online well worth purchase thanks
415,1,month work gr8
417,0,garbage turned phone home screen blank home screen app keep crashing useless doubt ever even got turned check work refurbishing
418,0,app set home page work information apps transferred new phone could access apps setting apps homepage samsung tech support tried help get working sent contracted repair shop o reinstalled work either tech said likely defective motherboard never issue ordering phone amazon upset store sold phone test
422,0,got phone fedex black buick showed randomly delivered phone got good first 30 min opened camera app see working would open app upfor give warning say camera app failed tried crash phone would update would tell update interrupted try next 24 hr last certainly least already locked att despite getting unlocked fingerprint scanner work said fingerprint scanner needed calibrated tried everything even called samsung tell happened remotely controlled phone everything could tell go samsung store deming nm store live recommended trade s23 discounted price even tried safe mode nothing worked saying buy saying buy caution wish took video already returned phone day got
