Username,Date,Reviews,Rating,Model 
Placeholder,7/17/2024,"The initial setup took a little while but that is to be expected with a new phone, tablet, etc.  The tablet is speedy, well designed, Samsung has some useful apps that come preinstalled and since I have an android phone I had my email, text messages and favorite apps up and running quickly. It is a great tablet at a reasonable price.The only negative is that the pen skips when drawing.  I decided to purchase a V-Pen to see if it was the pen or the tablet causing the problem, and the V-Pen works flawlessly with my drawing apps.  I was relieved to discover the problem was just the S pen. Product support (Samsung and Amazon) confirmed that I would have to send the tablet back in order to get a new pen (and tablet), which is the last thing I wanted to do after I had it all set up, so I decided to purchase some pen tips for the S pen to see if that fixes the problem.  The tip is wobbly, and I don't know enough about these pens to know whether or not that is normal. It's not really a problem because I like the V-Pen a lot,  but it would be nice to have a backup and know what was wrong with the S pen. (No, I'm affiliated with V Pen, it was a good choice for me!) I didn't see a need to give the tablet a less than 5 star rating because of the pen - the tablet is great, just be aware of the fact that the tablet has to go back too in the event the pen has issues and you need a new one. 5 stars!",5,Galaxy Tab S6 Lite
Micah L.,10/6/2024,"I bought this during a flash sale, thinking I would update my tablet and wanted the included pen. For my purposes, the Lite model is ok.  Shipping was fast as expected, the price was good, but unfortunately, the battery life stinks compared to my 2017 tablet!  That's my only real complaint. The battery on my 2017 lasts 30-40% longer.",4,Galaxy Tab S6 Lite
Kris|Kris,10/16/2024,This tablet is good for the price I paid for it. I mainly use it to watch videos and it has a decent display although it is a bit laggy when running games. This tablet last me around 7 hours of constant use. Overall pretty decent,4,Galaxy Tab S6 Lite
Daniel,1/24/2025,"Great tablet. Size is good and though slow at times it can handle plenty of books and games. The only problem is the s pen- the tip has started popping out of place only after a month of use, not even everday. Disappointed but otherwise great tablet",3,Galaxy Tab S6 Lite
erda,12/17/2024,waiting to set it up.,5,Galaxy Tab S6 Lite
No-Go,8/21/2024,"I was excited to get this tablet even after reading through some negative reviews. I thought “how bad can the experience really be if this is one of the more popular Samsung tabs?”. Well, worse than I expected. The screen is not good and has uneven lighting that makes everything look washed out. I was not expecting it to be great, but I can’t believe Samsung would use this in any of their hardware. The tablet also instantly lagged upon going thru initial setup. It continued to lag and have unresponsive touches the whole time I tried to use it after setup.Three Pros I have are 1) the back facing camera quality is actually halfway decent. 2) The build quality also feels decent, as it’s a glass front and aluminum back. 3) It’s fairly lightweight.Otherwise, most things about this tablet are mediocre. Screen, speed, ram, front facing camera. I didn’t try out the charging so I can’t speak to that. For the price, most would be much better off going with the base model 9th generation iPad. The base model iPad is still high quality in most anspects and currently around the same price as this galaxy tab s6 lite. I would only consider getting this if you absolutely had to have an android tablet and your budget can’t stretch any further. But don’t expect it to come close to a more pricey android tablet or any iPad. I really think Samsung should step up their game and offer better value for their lower end tablets when it comes to hardware and experience. This isn’t it.",3,Galaxy Tab S6 Lite
Amazon Customer,1/6/2025,"I hate how Samsung nickle and dimes you to death. Everything you need to use the table is ""sold separately"". But you don't know that till it arives and you  can't use it because you don't have the connector or usb, and don't know until you open the package. Why can't they just send you everything and raise the price, which is not cheap to begin with.",3,Galaxy Tab S6 Lite
pfrimel,12/6/2024,"After I did all the share tablet, works like a charm. Everything came over. Very pleased, great price.",5,Galaxy Tab S6 Lite
Randy Browning,9/27/2024,"It is not loaded with a bunch of garbage, and the first thing I did was de-bloat it. With three apps installed, it seems to take longer at almost every start up to boot. I won't keep it for long and will move to the Tab S 10 when released.",4,Galaxy Tab S6 Lite
Sara,11/6/2024,This tablet has been perfect for what I need it for. I usually use it to watch movies and do work stuff. It runs faster at work than the typical equipment they provide for us to use. Movie quality and sound is great. Battery last plenty long enough for what I use it for. Overall it's been great a great buy and samsung galaxy has yet to let me down.,5,Galaxy Tab S6 Lite
Tomás Daniel Ridao,12/11/2024,Es lo que queria|,5,Galaxy Tab S6 Lite
Tulio Lopez,12/14/2024,Everything right,5,Galaxy Tab S6 Lite
Juice,9/24/2024,This is a nice tablet. I would buy it again. I wish samsung had a pen for all tablets. I use the pen to make and draw tattoos. I love how it has a SD card slot. Over all its small and fast.,4,Galaxy Tab S6 Lite
Jerry Berenger,10/9/2024,"Works fine just should have a faster processor. Should also purchase a charger, screen protector,  and protective cover.",4,Galaxy Tab S6 Lite
Phigg,10/27/2024,"While a little larger than I really wanted it to be, I have no complaints with this tablet;  I'm so glad I bought this to replace my old Tab A as my main tablet, because unlike the barely usable Tab A, this actually performs!  I no longer have to wait to open an app, this thing just responds snappily.Add'l features you gotta love, the external microSD card slot,  and this costs half what an iPad costs.  Highly recommend!",5,Galaxy Tab S6 Lite
Liz|Liz,8/4/2024,"I got this to replace my iPad Air 5th Generation which I did not like. This is perfect for my needs of watching YouTube videos, streaming services like Peacock and Hulu, maintaining a Facebook page and an Instagram account, and for online shopping, email, messaging, games, weather, etc. I could not set it up using my Samsung phone since it would not connect. I synced and copied everything via my iPad. It was very similar in looks to the iPad which I sold after I checked this Samsung Tablet against the iPad. It is very easy to use and is lightweight and a good size for my needs. It took a day to make sure that my phone and this tablet were totally synced and all of the apps were updated and working properly. I do a lot of customizing to my devices via wallpaper, adding folders, checking all apps, etc. I had no use for the S Pen since I could not use it as a stylus. I have two stylus pens that I use. I highly recommend this Samsung Galaxy Tab S6 Lite and would buy it again.",5,Galaxy Tab S6 Lite
Zayen,10/13/2024,Ordered for my 86 year old mother and she loves it,4,Galaxy Tab S6 Lite
Aldemar Santiago,12/5/2024,"Slim, big and powerful. Working as expected.",5,Galaxy Tab S6 Lite
Liz,11/29/2024,It's basic but functional. Great use for drawing & reading. Would recommend!,5,Galaxy Tab S6 Lite
Jean,10/26/2024,I like this S6 lite 2024. It is fast. I will be using it when I use my cricut design space for my tee shirts and cards etc.I do use it for other stuff.  I'm pleased with my new tablet. Be careful with the pen I broke mine putting the pen back into my case. It functions well.  It's very durable and wifi is great. Battery lasts longer than I thought it would.  You will love the S6 lite 2024 tablet.  Enjoy,5,Galaxy Tab S6 Lite
Ro,7/4/2024,"Prior to the Samsung S6 Lite, had the Amazon HD 10 + tablet,which was not a bad tablet for what I payed for. The S6 Lite 2024 Edition is leaps and bounds much better. Has only dual speakers not quad but the sound quality is so good helps that there is Dolby Atmos. At first was not keen on the S pen, after utilizing it found it as one of the best aspects of the S6. Having a built in GPS sensor is something I love about the tablet as I have transformed it as my main infotainment for my car and having Google maps to navigate on a 10.4 inch screen is much better than using my cell phone. Watching videos is great love the 2000 x 1200 screen resolution. Even though it only has 4 gig of ram, have not experienced any lag and being only 60 hz refresh no stutter. It's fast and snappy. Came preinstalled with Android 14, and from what I have read Samsung should support it at least up to Android 17 for the 2024 version, you may want to do your own research on it to make sure.",5,Galaxy Tab S6 Lite
Jose RDeJesus,10/11/2024,Buena calidad para el precio|,4,Galaxy Tab S6 Lite
Tomas Flynn|Tomas Flynn,11/29/2024,"|The media could not be loaded.|Muy buen rendimiento, el Spen anda de maravilla. La uso para toamr notas en la universidad y la verdad que la bateria dura bastante y funciona muy bien. Para los que dicen que spen se traba, lea dejo videito.|",5,Galaxy Tab S6 Lite
hanoncs,12/26/2024,"These tablets seem like fine, normal samsung tablets. But the pens are trash. The tips break under even the slightest pressure. And samsung doesn't sell tips, they only seen complete pens, for like $50 or more. I only paid $199, not paying $50 just for a pen, it wont even last very long.",3,Galaxy Tab S6 Lite
Jk,9/9/2024,Sharp enough image. Moderate enough storage. Responsive enough touch. Battery lasts long enough and charges fast enough. What more can a man ask for? It's enough.,4,Galaxy Tab S6 Lite
Kemar Watkins,10/31/2024,"I started thinking about whether or not I wanted an iPad or if I wanted to get something more affordable, and this was the best decision I could have ever made. The software is good notes compatible so for any students that take notes on paper in class this would definitely help save you time and paper",5,Galaxy Tab S6 Lite
noah carroll|noah carroll,12/23/2024,I bought this tablet about 5 months ago for school and then I didn't need it for a bit so I left it inside my backpack and now its showing a charging icon but won't turn on,3,Galaxy Tab S6 Lite
Maria Rodriguez,11/29/2024,Love my tablet,5,Galaxy Tab S6 Lite
JERSON REYES,11/8/2024,"Excellent product, it is as it is written ??, I have had it for 5 months now and have not had any problems, basic uses for studies and certain tools",5,Galaxy Tab S6 Lite
Uniquely Jas,7/25/2024,"The performance is decent something it lags when using the swipe feature to close apps, no issues with gaming. Sturdy, the size is bigger than I thought. I mostly used this tablet for digital drawing/coloring and the pin works great just don't be rough or you will break the tip",4,Galaxy Tab S6 Lite
Jack J. Bulkin,8/24/2024,Nice little Tablet. Great for my son to use in classes rather than wearing down his laptop.,4,Galaxy Tab S6 Lite
Dawn,11/14/2024,Easy to setup and use. It is compatible with a stylus which is nice.,5,Galaxy Tab S6 Lite
RedWolf,10/11/2024,Screen size is perfect for me. I got the tablet for drawing and online courses. So far works great. I also like to use it for streaming shows and surfing the web. The pen works well I just forget that I can't use my finger and the pen at the same time. I love that you can use the pen to write in the search bar,5,Galaxy Tab S6 Lite
Sarai,12/18/2024,"It runs super fast and very well !!I can have Roblox , calls and music playing and it will still run pretty well. Tons of storage for my school work and apps that I use for essays and readings . I like how very slim it is because I’m able to take it with me to school in my backpack or my purse . It’s a very fun and unique tablet , it’s very handy if you need something that’s handy for school and for games !!! I definitely recommend it",5,Galaxy Tab S9
Joe L|Joe L,7/29/2024,"This tablet is more than enough for my needs.The speed, graphics, crisp and vibrant screen, all make for a wonderful experience. I was originally looking into the ultra, but I couldn't justify the purchase when the only real differences are screen, speaker and ram related, and nothing i'll do with it will really max out the current specs. The speakers sound amazing on this thing. Most tablets just have cheap tinny speakers just to fill the spaces while the Galaxy S line seems to have had a lot of thought put into sound quality. The camera is quite decent as well. Not top of the line, but for a tablet, it takes some pretty clear photos.It charges quite fast as well, and stays charged for a while, even with heavy game play, just like my S23 U. I did about 3 hours of straight play on war universe and it was still around 80% when I shut it down.I did make sure to get an illuminated magnetic keyboard case, and a high speed 512gb Samsung Micro SD card for it. Don't need them, just wanted to get them and got a good deal. The next thing I get will be a bluetooth mouse to complete the laptop feel. lolThis is the best tablet for the money in my eyes.",5,Galaxy Tab S9
Anonymous Geek,10/16/2024,"Bought this tablet to replace a Samsung Galaxy Tab S6 which wasn't able to be updated any more. The S9 is noticeably faster and the video quality is excellent, seemingly even better than the S6. I use VLC software to play videos and the new tablet shows no lag and no drops/stalls. Transferring my data from the S6 was done using SmartSwitch (highly recommended) and the USB-C to USB-C cable that came with the S9. This was really very fast. Loading new videos to the S9 from my PC was also fast, much faster than for the S6. No issues at all. Highly recommended.",5,Galaxy Tab S9
Julian,8/23/2024,"Originally, I bought this Tablet with the intent to use it for gaming. Ultimately, I found that there is so much more you can get out of it than that.Its a very thin, lightweight tablet. The screen is an impressive size that felt larger in my hands than I had expected. I was originally considering going for the Ultra, but the size of the S9+ is more than enough for what I need. I actually feel more comfortable using this tablet without the protective case that I purchased for it when at home. I didn't even bother putting on the protective glass screen I bought for it because I don't see myself abusing this tablet as hard as I abuse my phone.The performance is fantastic. This has no problem playing whatever games you might want to play on it and the refresh rate is superb. As someone who regularly uses a high refresh rate monitor, I can appreciate seeing similar performance on a tablet.What I wasn't expecting when I bought this was how much I could get out of Samsung's Second Screen app. This built in application allows you to wirelessly connect your Samsung tablet to your PC and use it as an additional monitor. As someone who regularly uses a laptop for work, its a game changing asset to have. The integration is seamless; you can even choose to enable the touchscreen so that you could browse through documents like you would with a kindle without having to go through the hassle of doing file transfers.However with performance comes a price. It goes without saying that these tablets are pretty damn expensive. If I had to make a recommendation, I would suggest settling for the S9 which my friend bought and is more than satisfied with. Most of what you are getting out of making the jump to the S9+ or Ultra is a larger screen size. Visit your local electronics store and see which one is right for you.",5,Galaxy Tab S9
Dnl,9/6/2024,"In today's tech market, all products are expensive.  The Samsung Tab S9 is an amazing device and out performs all other tablets, imo. I prefer it over the giant iPad I have, and this is the 3rd Samsung Tab I have owned.Setup was simple. Just connect with my phone (S23) and done.Classic black body, tons of memory and storage.  Snappy response and beautiful screen.",5,Galaxy Tab S9
Anthony,1/6/2025,"I needed a new tablet and this S9 was perfect for me. Primary use it for note taking. Great deal, and everything works as intended. Pairs well with my galaxy phone as well.",5,Galaxy Tab S9
Alvin,6/8/2024,"I bought the S9 over a month ago used through Amazon. It's a daily user for small task like, produce web research, typing document and YouTube content. The battery holds up the entire day with moderate use which serves my need. Beautiful color rendition, quick, awesome quad speakers. For a Dex experience, a portable keypad for example, Dexnor or similar is recommended.",4,Galaxy Tab S9
PhillyGirl,2/11/2024,"My previous Samsung Note tablet circa 2014 is very old. Not wanting to purchase a new tablet I reformatted it hopefully to bring it back to life. But its old and not useful for todays apps. About a year or more has passed before looking again at the tablet world.  I rocked a Samsung not 8 phone well past its use and recently upgraded to a S23. I absolutely love the S-pen and S-Note. My new tablet had to be pen capable. Just using a pen is way different than pen features baked into the ecosystem of the device.Enter the S9 tablet family. I played around with the idea of getting by with one from the S8 family because of expense, but I like bells and whistles. I also intend to have this tablet for many years, so OS updating is important.I picked the Samsung S9 plus. Amazon was offering it with 512gb with 13 percent off which was 30 bucks cheaper than the 256gb version. I've played the available built in storage game before.  I'll be using this tablet for a variety of functions so having the larger  space for apps and all of my projects will be nice.Test...First I charge to full capacity before turning it onI then used Samsung's transfer tool and copied my apps from my S23 to the S9 plus tablet. This worked without a hitch.Let those apps updateUpdate the OS under settingsPlay time....Audio-I read that the sound of this tablet was superb so I head to play something from my Amazon collection before heading to YouTube to play some videos. It has rich bass and volume.Video-I played a video from my digital library, Amazon, YouTube and Vudu. Colors were nice and bright so no surprises thereS-pen-Although they were creative with the magnetic back storage, I wished it was like the phone and my old tablet with the S-pen stored inside. The pen itself is pleasantly thicker than anticipated. Samsung made a good move in matching the color of both the pen and tablet. There's a lot of features to learn if you care to. The included S-notes is a beast of a program, but you can also use other programs like OneNote.The only thing with the form of this tablet is it is long horizontally. So when holding that way it seems a bit long. I rather like the more square shape of my old tablet. There's a lot to learn about the features and youtube is a great tutor. Even just now typing this out one came to me with holding down the Ctrl key. It lights up the letters y, a, z, x, c and v which are shortcuts for specific functions. Very cool!When you get it, pay attention to the return policy and use it to death within that time frame. This is already long so I may update only if I come across an issue that impacts negatively.It is pricey, but it is a premium feature tablet. You can get cheaper with going with lesser specs.",5,Galaxy Tab S9
Sam,12/30/2024,"Love this tablet, it runs fast and switches smoothly from app to app. The landscape mode is the only thing I don't really like, it will only turn one direction to watch in landscape which is not convenient. I would check to see when the newest one will be released before spending over 1K on a tablet though. You could end up with an older tablet when the newest is coming out in a month or so.Battery life is great, I use it every day & listen to it all night every night. Easy to set up, easy to use, easy to transport or travel with. Easily pairs with any Bluetooth keyboard and any other BT devices.",4,Galaxy Tab S9
microdoc,1/10/2025,"My wife loves the performance, light weight, did I mention the amazing speed? I am a MacBook M1 and Linux Mint user, so i cannot attest to much more, but if it makes her happier, I am very glad I bought it for her. She is very impressed with the performance and thorough features of the operating system.",5,Galaxy Tab S9
Andrew K.,12/28/2024,This is one of the best purchases I have made over the last few years. Served me well for my productivity. Allows me to get work done out of my desk. And with apps like Second Screen make it an extra monitor on my desk.  And you can always remote into other devices using it. It is quite versatile.,5,Galaxy Tab S9
ChillinInVegas,12/26/2024,"I like Samsung devices because they're user friendly.  This tablet didn't disappoint.  I've been using it for months now, and it's still going strong with no problems.  Clear, crisp display, with vivid colors for steaming movies, videos and gaming.  I'm happy with my purchase.",5,Galaxy Tab S9
aiden,1/11/2025,"I like it very much, it's great to learn sketching for kids, thank you",5,Galaxy Tab S9
Charlotte Emily,10/26/2024,"i got sucked down the rabbit hole of digital planners and stuff from YouTube shorts, and between that and wanting to learn how to digital draw at some point, i ended up getting this on Prime Day for $750 ($794 after tax i think). I 1000% recommend getting it for that price vs the $900+ as that's so much for a previous series with the 10s out now.for that price, it's amazing. i plan to try to keep it going until 2030 just like the new PC i got in June, and if i get that much use out of it, i'll be so happy.dex mode is underrated, and all my stuff BT-connects without issuesyou can also music share with a samsung phone so they can both use the same headphones/earbuds.my friend even made a comment about how he thought it was very nice as someone who's never really gone after serious tablets before. so i take that as a win as well lol",5,Galaxy Tab S9
Puchila,1/4/2025,"I’m enjoying the tablet very much, the size is a little bigger than what I wanted, but I’m enjoying it ,recommend",5,Galaxy Tab S9
ShareBear,8/21/2024,"** 3 Month update ***I’ve set up a reliable Dex ecosystem for my Samsung tablet, Caldigit TS4 to expand the number of ports available, wired mouse and keyboard, and a monitor (HP Omen). With this setup I can run Dex flawlessly (Dex is a built in desktop operating system that comes with Samsung smart phones and tablets)My primary uses for this device are Google workspace (you have to use the chrome browser for all features, the apps are functional, but lack a lot of editing features), web based management systems, and media.The stock speakers are great (comparable to laptop speakers, a little tinny, but generally sound great for the device class)The screen is gorgeous, and as a stand alone tablet you can absolutely use Dex with a Bluetooth mouse and keyboard on the fly, managing a couple windows side by side feels comfortable (not too small)Could this replace your laptop? So long as you don’t rely on specific software. Absolutely, this would be great for student or business owners on the go. Not too big to bring with you, but not too small to be unusable.This thing has exceeded my expectation for sure. Same internals as the ultra tab, smaller screen.Perfect for excel, google sheets, word processing, and when paired with mouse and keyboard is effectively functional as an ultra portable laptop.If most of your work is web based or general word processing 10/10 I’d recommend.Haven’t had any issues with lagging, overheating, or battery health.I do recommend adjusting your battery settings to prevent it from charging past 80%, and while it is convenient disabling fast charging will help preserve the battery life in the long run.",5,Galaxy Tab S9
S. Reyes,10/4/2024,"First off this tablet is great! My recommendation is to price around once a week and see the various colors they offer. It changes! When I bought this one, the beige was cheaper than the black. Then the following week when my husband wanted one. Both of them where at the same price and a few cents more expensive then what I bought mine.I got this tablet to replace my laptop. Don't get me wrong I would rather be on my laptop but due to a wrist injury I can't lift much without help or being in pain. So this is why I got it.I'm a samsung user in general so the setup was easy for me. Everyone's learning curve is different. Wifi is good but the downside it will try to connect to everything! Even the neighbors stuff! Changing and keeping the charge is fine but it drains quickly if I'm watching youtube or playing a moblie game like Honkai: Star Rail. I think I can get 4 hours of Honkai without and be at 10%.",5,Galaxy Tab S9
