Username,Date,Reviews,Rating,Model 
Charlotte Emily,10/26/2024,"i got sucked down the rabbit hole of digital planners and stuff from YouTube shorts, and between that and wanting to learn how to digital draw at some point, i ended up getting this on Prime Day for $750 ($794 after tax i think). I 1000% recommend getting it for that price vs the $900+ as that's so much for a previous series with the 10s out now.for that price, it's amazing. i plan to try to keep it going until 2030 just like the new PC i got in June, and if i get that much use out of it, i'll be so happy.dex mode is underrated, and all my stuff BT-connects without issuesyou can also music share with a samsung phone so they can both use the same headphones/earbuds.my friend even made a comment about how he thought it was very nice as someone who's never really gone after serious tablets before. so i take that as a win as well lol",5,Galaxy Tab S9+
Puchila,1/4/2025,"I’m enjoying the tablet very much, the size is a little bigger than what I wanted, but I’m enjoying it ,recommend",5,Galaxy Tab S9+
ShareBear,8/21/2024,"** 3 Month update ***I’ve set up a reliable Dex ecosystem for my Samsung tablet, Caldigit TS4 to expand the number of ports available, wired mouse and keyboard, and a monitor (HP Omen). With this setup I can run Dex flawlessly (Dex is a built in desktop operating system that comes with Samsung smart phones and tablets)My primary uses for this device are Google workspace (you have to use the chrome browser for all features, the apps are functional, but lack a lot of editing features), web based management systems, and media.The stock speakers are great (comparable to laptop speakers, a little tinny, but generally sound great for the device class)The screen is gorgeous, and as a stand alone tablet you can absolutely use Dex with a Bluetooth mouse and keyboard on the fly, managing a couple windows side by side feels comfortable (not too small)Could this replace your laptop? So long as you don’t rely on specific software. Absolutely, this would be great for student or business owners on the go. Not too big to bring with you, but not too small to be unusable.This thing has exceeded my expectation for sure. Same internals as the ultra tab, smaller screen.Perfect for excel, google sheets, word processing, and when paired with mouse and keyboard is effectively functional as an ultra portable laptop.If most of your work is web based or general word processing 10/10 I’d recommend.Haven’t had any issues with lagging, overheating, or battery health.I do recommend adjusting your battery settings to prevent it from charging past 80%, and while it is convenient disabling fast charging will help preserve the battery life in the long run.",5,Galaxy Tab S9+
S. Reyes,10/4/2024,"First off this tablet is great! My recommendation is to price around once a week and see the various colors they offer. It changes! When I bought this one, the beige was cheaper than the black. Then the following week when my husband wanted one. Both of them where at the same price and a few cents more expensive then what I bought mine.I got this tablet to replace my laptop. Don't get me wrong I would rather be on my laptop but due to a wrist injury I can't lift much without help or being in pain. So this is why I got it.I'm a samsung user in general so the setup was easy for me. Everyone's learning curve is different. Wifi is good but the downside it will try to connect to everything! Even the neighbors stuff! Changing and keeping the charge is fine but it drains quickly if I'm watching youtube or playing a moblie game like Honkai: Star Rail. I think I can get 4 hours of Honkai without and be at 10%.",5,Galaxy Tab S9+
Vakmere,8/17/2024,"Pro: Great screen and sharpness. Very fast going to any screen, browser, menu scrolling, easy to learn more about all its functions by going on YouTube. I got the 512G memory so plenty of space there. Got a nice case for it. Easy-to-use keyboard is also a plus. Synch easily to my Samsung phone as the Quick Share makes short work of transferring data and apps to this tablet. There's more positives however the fun is exploring it. Bluetooth finds your printers easily and is very useful.  Games are handled very well. Syncs to any other Samsung appliance, TV, and others. Screen protector is something you'll need to decide on. S-Pen is very useful, a learning curve is needed buy easily learned.Con: I don't like Google Sheets or Docs. Very annoying to use especially if you are used to Microsoft Works. To use MS Excel or Word here a subscription is need. Using Google Sheets and docs takes a few YouTube video searches. Can be very confusing trying to find files.No SD slot. No earphones jack. No 5G unless you specifically get one with it. Useless outdoors away from a WIFI signal. Battery does drain a little faster than I'd like and fast charging isn't really that fast.Summary: You'll like this tablet. Screen size is just right and updated regularly the functionality is very high. Screen is very reactive with touch and quick. You'll like it.",4,Galaxy Tab S9+
jesse,12/28/2024,"Great buy, even @ the end of 2024. Great performance in all aspects",5,Galaxy Tab S9+
Armando A.,12/26/2024,"This tablet is great, hardware very fast, software exceptional",5,Galaxy Tab S9+
Yordani alexis alvarez sepulveda,12/27/2024,Super rapida,5,Galaxy Tab S9+
Alana Duncan,9/17/2023,"Tablets and I typically don't get along, especially on the Android side of things, which is why my enthusiasm for this tablet has really caught me by surprise. I've owned a few Android tablets, an iPad Mini, and a little Surface tablet -- and mostly these experiences taught me that, just maybe, tablets aren't for me. I always missed having a cursor, or having a keyboard that wasn't a case, or, most of all, programs on my desktop (or even just my Chromebook). So I kind of turned my back on tablets for a while. I was using my two-in-one Samsung Chromebook 2 as a tablet, but the myriad of issues that have recently cropped up on that device made me want to try an actual tablet again.Enter the S9. I've loved this thing from the moment I unboxed it. Calling the color 'beige' almost seems like an insult; it's a nice, silvery white that really makes the device stand out, and the matching color of the S Pen is a nice touch. And the screen is absolutely gorgeous, I can't stop admiring it whenever I wake it up. The colors and brightness are really great, and you can fine tune the latter for your needs. I haven't tried using it in a full blast of sunlight, yet, but it's excelled everywhere else. Portability is a breeze since the S9 is so light. Even with the case I have for it, which adds a bit of heft, it's still much easier to carry around than my Chromebook. And the functionality! I have the Samsung Flip 5 and the Samsung Buds Live, and the S9 interfaces with both of them flawlessly. I can look at messages from my phone (and it also grabbed a bunch of info from it, saving me time) and listen to both my tablet and my phone on my Buds Live, among other things. Gone are the days that I need to pack a separate headset/earphones for my tablet and my phone. It's such a stream-lined setup, I love it.This is ordinarily where I would list all of my cons, but I don't have a lot, honestly. My only dissatisfaction is how expensive the S9's Samsung accessories are (how much for the covers? oof!), and how limited, but maybe more will spring up in time. I used to dislike how limited apps were on Android tablets, but now you can get a huge plethora of apps that connect to your destktop versions. It really just depends on what you use and how you work.So, yeah. I love this thing, as you can tell. I've written this review on it, even. If you need a tablet spruce-up in your life, and you own some other Samsung products, I recommend this one.",5,Galaxy Tab S9+
lawyer in Pittsburgh,7/17/2024,"I mainly bought this my first tablet device to take notes on in a way that would store my notes in an easily accessible place and be available to me across devices (on my phone and PC as well). I am having trouble getting my notes from OneNote to synch to the cloud so that my other devices can see them. That is more of a software issue. I bought a Samsung Galaxy Tab S9 NotePaper Screen Panel to improve the writing experience for note taking, which was an improvement. I did not love the writing experience on the bare screen. Too slippery, and too much unintentional palm interaction with screen. I also bought a Dexnor keyboard case for it, which works pretty well, but it is not a great typing experience. Just useful in a pinch. It has good battery life and seems to have good processor speed. All in all I am not sure this was a wise investment to try to transition to digital note taking, away from paper. It remains to be seen if I stick with it or switch back to paper. I have to get the synching working to stick with it.",4,Galaxy Tab S9+
GoodTea,12/22/2024,Very Good.,5,Galaxy Tab S9+
Doc Jim,9/10/2024,"Finally! A tablet that delivers performance like I have never seen before in an android tablet. Fast screen refresh time and very responsive GPU and CPU. I did have a problem using the smartswitch app. While trying to use smartswitch to copy my phone contents into the tablet, the app wanted to update but was unable to. I allowed the tablet to complete its installation and initialization and when it was done, I updated the smartswitch app then tried again this time with glowing success.I have some concerns with the expected lifetime of this tablets amoled screen but I have read that Samsung has taken steps to prevent burnin and other screen problems.If you want solid performance in an android tablet then this is the one to get. I would not recommend giving this level of tablet to a child.I wold have also purchased the book case keyboard with it had it been available,",5,Galaxy Tab S9+
Vincent Van Gopher,8/21/2024,"This tablet is so fast and has a great screen and surprisingly good sound for something so thin.  A relative actually had to ask me to turn it down when I was playing a news broadcast in the next room while they were on the phone.  I wish my Chromebook sounded this good. The fingerprint sensor is super fast and reliable. It also holds a charge really well.  It doesn't run down quickly when in heavy use, and when I just leave it on for a couple days without using it much, it's still above 90 percent on Day 3.IMHO the Android system is much more user-friendly than Apple's, and I have a Samsung phone, so it was especially quick and easy to set it up with the apps I like to use -- it all transferred over by logging in, basically.  I still have to learn all the features, like using Dex, pop-up screens, and the stylus.I do like the form factor of the iPad slightly better -- prefer the more rounded edges. Otherwise, this is pretty much perfect.",5,Galaxy Tab S9+
Cliente Kindle,12/22/2024,"|The media could not be loaded.|As a huge Samsung fan, I couldn't have expected anything less than the highest quality technology. The Tab S9+ surprised me and surprises me every day. The purchase through Amazon was quick and easy, best discount, taxes and delivery! The product arrived in perfect condition.",5,Galaxy Tab S9+
Pat T|Pat T,9/26/2024,"Set up was simple, and from what I can see for right now no scratches or cosmetic damage of any kind so far and it is running perfectly. The photo I took doesn't do it justice. The screen has great vibrance and clarity. Overall it's great for now. The only thing I find weird is the magnetic pen placement nothing wrong with it but I feel it should've been created differently like some sort of magnetic pocket but that probably what the cases are for.",4,Galaxy Tab S9+
NoReply,12/7/2024,Get on black friday sale,5,Galaxy Tab S9+
Native American Spirit,9/23/2024,"I chose the smallest of this Samsung line. it's a little bigger than most tablets, but is a perfect for,  well, most everything! I'm so pleased with my choice! the snapdragon processor is fast and smooth, the new screen glass provides extra protection,  for me,that's a great thing,  wifi is awesome fast and no problems. love the on screen touch buttons and you barely have to tap the screen for responding,  nice and sensitive! this size is very portable! this tablet can do so much more, it's like a mini laptop. Excellent blacks and the 4k is mind blowing,  you can't go wrong with Samsung! When I bought mine it was a little pricy, but it will last for many years to come and won't outdated. we have a new Samsung oled 65"" tv and this tablet is compatible with it and all other Samsung products.",5,Galaxy Tab S9+
Dave,11/19/2024,Great tablet.  Wifi 7 is fast - I get close to 500 MB per second.  Processor fast as well.  Screen is very clear.,5,Galaxy Tab S9+
Latice T.,11/8/2024,im very happy that i can have the choice to hook it up to my phone carrier or leave it just as wifi. It arrived well packaged and it works great. No complaints at all. im glad I made this purchase.,5,Galaxy Tab S9+
Iugirl524,11/7/2024,"Awesome tablet. Super fast, the screen is great and does everything I need. Only thing I wish is that I could get Samsung and Apple to work together for messages. There has to be a way to do it if I don’t have a Samsung phone.",5,Galaxy Tab S9+
Mike Herrera|Mike Herrera,8/12/2024,"Como lo dije en el título es mi primera tableta nunca me había interesado en comprar una tal vez no era el momento pero luego deber las ventajas que tienen y que tenia un muy bajo precio me decidí por la Samsung Tab S9Plus quizás hubiera podido comprar A9 o S9FE pero quería obtener la gama más alta así que luego desempaquetar lo primero en notar lo liviana y ligera que es,  su pantalla es muy hermosa y su sonido de calidad es espectacular 4 altavoces bien amplificados también la precisión de su Spen para dibujar es practico para destacar compre la 256GB bueno si necesito más almacenamiento con una memoria Micro SD puedo aumentarle otra cosa que me gusta  lo rápido que se sincroniza mi TV Samsung  y con mi  S24U definitivamente excelente compra y estoy muy feliz así que la voy a agregar a mi pequeño ecosistema Samsung.|",5,Galaxy Tab S9+
Jesus Ivan,12/4/2024,Producto 100% recomendado|,5,Galaxy Tab S9+
Bruce,12/4/2024,Great job,5,Galaxy Tab S9+
danny,1/1/2025,Got for Christmas to replace my other samsung tablet. It works great and is faster than my last tablet. My only problem is that they have so many different options and it is hard to get the best one. You just don't know what options are the best for your money or your just getting ripped off buy paying for something that is the same as the another one that is cheaper. Samsung changes just one word and then charges even more money for something that is the same.,3,Galaxy Tab S9+
Biggles,5/18/2024,"When I first started setup, I had a major issue with this product. It damped what should have been an exciting time. The tablet is definitely a superstar, but I had an issue getting the Samsung keyboard to show up. This is my 4th Samsung tablet, so it's not like I'm some newbie. I won't drag this out, but it took an online video for me to find the missing component. After that, the magic began. This is the reason that I'm giving the tablet, a definite 5 star, a 4 star rating. It shouldn't take online videos to get the startup successfully completed. I'll still buy Samsung products and still love them, but I wish this could have gone more smoothly. I definitely recommend this tablet and hope your purchase goes smoothly. ETA:  this is a rewrite of my original posting as I always want to be as fair as possible in my reviews.",4,Galaxy Tab S9+
pancho,8/14/2023,"So far, the Tablet has been amazing. This is the first time I own a tablet, so I was really satisfied with the size of the S9. To be honest, I was going to buy the S9 Ultra until I realized that I just wanted it for reading and perhaps basic gaming (i.e. Dead cells, gacha games, etc.). I was worried about the S9 since I did not know what to expect for 11', but it has been great and works well. If you are planning to use the tablet as a book, video watcher, and basic gaming, I believe the S9 will suffice. Since I already have a great laptop, I realized that a bigger size was useless for me. So, the size for a consumer that is planning to use it for basic functions will be happy to know that the S9 is more than enough.I like the design of this Tablet; it looks super nice, and the included pen helps a lot when maneuvering around the screen. Actually, I own a Samsung Galaxy Note 9, which is old, but it came with a pen as well, but I never used it; however, with the table, I believe it is critical since it is too big for me to reach the top of the screen (And this is an 11', I cannot imagine how hard would have been if I had a bigger one).The only bad thing I can think of is not with the Table itself but with this listing, they tell you it will come with a ""FREE"" book cover, but I didn't receive it. Amazon was nice enough to give me a partial refund, but now I have no cover T_T. So yeah, don't expect a free book cover. Actually, this is why I lowered the rating since the product itself is fantastic. Nonetheless, the retailer failed to provide me with what they promised. Even when I went to their website, they didn't help at all! It was annoying since they will be like go here, go there to end up not getting anything and wasting time.TL;DR: The tablet is great, comes with a nice pen, and is beautifully designed. However, they didn't give me a book cover. Nonetheless, Amazon helped me by giving me a partial refund.",4,Galaxy Tab S9+
Mary H.,7/29/2024,"I moved up from a 5 year old 10"" Samsung Galaxy tablet to this one and have not been disappointed. It has great color and fast processing. There are a lot of features new to this one that I still am learning to use. The S Pen is convenient and the camera takes excellent pictures. The screen is big enough and has great clarity so I can put it on my lap and watch movies in bed. The only drawbacks are the weight (it's heavy) and the battery life which I don't think is as great as Samsung promotes it to be. I did buy a protective cover for it which of course increased the weight. I bought it on sale on an Amazon Prime day so overall I'm happy with this purchase.",5,Galaxy Tab S9+
David C. Harris,5/18/2024,"I had never been an Android tablet user and I received a Samsung A7 Lite from T-Mobile supposedly for free, but it was not free. The A7 Lite was very under powered and could not keep up with program/app demands. I had been very pleased that I could put apps on the tablet that I really did not want on my phone. I used the Fit-Bit app as well as the Toyota app quite often, but they were slow. After about 2 years and a number of app & OS updates, the Fit-Bit and Toyota apps were almost worthless; the Toyota app was taking days to update my car's charging history, and the Fit-Bit app took 3 or 4 synchronizations, and still might not be accurate; I thought the problems were with the service and not my A7 tablet. I took a chance on this S9 because it had more memory and a more powerful processor, and boy, I could not be happier. My Toyota charging history has been up to date within hours, and the Fit-Bit data is a one-and-done when synchronizing.  My old A7 would not stream my video from my Synology NSA, but the S9 has no problem. I am very, very happy with my S9 purchase.",5,Galaxy Tab S9+
Verified Customer,9/16/2024,"Its a Samsung so you know it is a great quality tablet. Super fast and holds a charge for a long time. Screen makes images look great. I did reject the order because it was supposed to be overnight and I needed it. I went to Best Buy and bought it there. Amazon is getting bad on actually getting you the order overnight.  I had to wait 3 days to cancel the order because it sat in some warehouse.  Then it took 10 days for them to credit my card. An item that cost $1000 and is never delivered, should be refunded right away.",5,Galaxy Tab S9+
AmazonCustomer,2/4/2024,"I've always bought the cheaper Samsung A series Android tablets and they've always disappointed in the long run. The S9 is just so responsive and quick at everything it does that I think it's worth the higher price. The OLED screen is excellent overall and it's just a joy to use.I tried to go the iPad route to see what all the hype was about and bought the base model 9th gen about a year ago. It was a pretty good tablet with a nice screen and decent speed, but the Apple ecosystem just wasn't for me. The S9 is better at everything and doesn't have big black bars on the sides of your videos due to Apple's unique display ratio. The 120Hz screen on the S9 is amazing. It made my iPad feel terrible to use when I went back to it for a comparison.I think most of all I missed the Google discover news feed (swipe left when on home screen). Apple news is a paid thing for most of the content and I found myself using my android phone to get my my news feed vs. my Apple tablet. The Google news app on iPad just wasn't the same. One thing I really did like about the iPad was the gestures. Turns out that android has pretty much identical gestures in the display options  and it's the best of both worlds for me on the s9 now. Don't think I'll have to upgrade for quite a while with how powerful this S9 is!",5,Galaxy Tab S9+
MD,9/6/2023,"I bought this to replace a similar Galaxy Tab S4.  Nothing wrong with the older tablet, just was ready to upgrade- five years of use and not a single problem with it!  Anyway, there is almost no question the Tab S is the best Android tablet. The LED screens are just fantastic.  This new model is even faster yet.  0.5"" bigger screen (11"" instead of 10.5"") and almost the same size and weight.I got in on the deal that increased the memory and doubled the storage for no extra charge, so an astounding 12GB of memory and 256GB of storage- both way more than I will ever need.  S-pen works very well.  Sound is great (for a tablet).  Love the new in-screen fingerprint sensor.  Micro SD card slot works perfectly.The only thing I hate is that there is no headphone jack.  Almost didn't buy it for that reason, alone.  I hate using adapters/dongles.  And to use a dongle means I have to pry out the magnetic USB charger connector I love, every time, which is very difficult to do and I will likely lose it because it is so small.  There is ZERO reason to not include a headphone jack.  There is plenty of space, and they make jacks that are just as water-resistant as the USB port.  OK, I will stop with that rant.Oh, the price is crazy too.  Most people simply will not spend this much on a tablet, opting for something like the ""A"" line instead.  This model was $200 MORE than the crazy high price of my old S4, but the screen on the ""S"" is just so nice, so I just gotta have it :)",5,Galaxy Tab S9+
Heather Byrd,11/10/2024,Great price and has held up very well for my teenager!,5,Galaxy Tab S9+
Kathy,6/27/2024,"This is my 3rd Samsung Galaxy S series tablet. I upgraded from my S6 to this one.  While the cost is more than I'd like to spend, the quality is great. The pictures are crisp and the speakers are great. The S pen that comes with it is a great feature and I'm glad it comes with the tablet and isn't an add on accessory. I got the base model which is similarly sized to my S6 because it was what I could afford.  I'd like to get the bigger model (plus or ultra) but they are just cost prohibitive.  The S series still has an expandable micro SD card slot, which I use.  I'm a die hard android user, so after months of consideration, finally caved.  Gave my daughter the S6 and now we are both happy.",5,Galaxy Tab S9+
Carolina Blackman N|Carolina Blackman N,10/19/2024,"I'm a Samsung fan, and I love this tab. It's big and comfortable, and it's portable in any type of bag. Also, the processor it's really good, I'm using my tab for running games and taking notes.",5,Galaxy Tab S9+
Nate H.,9/29/2024,"Purchased to eliminate my use of paper. I've been looking for a way to do this for a long time.The pen and review on PDFs in Samsung Notes took a minute to figure out. Not that I have it figured out, I can better review documents and provide feedback than when I was stuck on paper.",5,Galaxy Tab S9+
Theodore Nichols|Theodore Nichols,6/20/2024,"I was torn between getting a Windows Surface Pro or a Galaxy Tab for a while. I wanted something portable that I could use as a computer to access my files online, work with my photos in Lightroom, and take notes or draw. I ultimately decided to go with the Tab S9 because of Samsung's strong reputation in electronics, their integration with Windows, and the DEX feature.I'm not disappointed, as the Tab S9 meets all my expectations. I’ve started bringing it to work for productivity and note-taking is fun now that my handwriting can be converted to text. However, Android software is not Windows, and trying to replicate my PC experience on the tablet has encountered some roadblocks. Fortunately, there is always a workaround.",5,Galaxy Tab S9+
