Username,Date,Reviews,Rating,Model 
Ali,9/5/2024,"Xiaomi Redmi Pad SE: A Budget Champion When it comes to affordable Android tablets, we often expect a familiar story: mediocre build quality, outdated internals, sluggish performance, and a short lifespan. But the Xiaomi Redmi Pad SE defies those expectations. It's the first Xiaomi device I've used, and I must say, I'm impressed—even though this is a budget tablet1. Here's why the Redmi Pad SE stands out: Impressive 90Hz Refresh Rate: What sets this tablet apart in its price range is its 90Hz refresh rate. Most budget-friendly tablets stick to the standard 60Hz, but the Redmi Pad SE steps up the game. With smoother animations, fluid transitions, and remarkably responsive scrolling, it feels surprisingly premium2. Solid Build Quality: The metal body of the Redmi Pad SE feels good in hand. Xiaomi didn't compromise on materials, and it shows. You won't mistake it for a flimsy paperweight anytime soon. Decent Performance: Powered by the Qualcomm Snapdragon 680 4G, the tablet handles everyday tasks well. Whether you're browsing, streaming, or multitasking, it won't leave you frustrated. Multimedia Features: Quad Speakers: The Redmi Pad SE boasts quad speakers, making media consumption enjoyable. Expandable Storage: With 128GB of storage (expandable via microSD card), you won't run out of space for your apps and files. High-Refresh Display: The 11-inch IPS LCD display with a 90Hz refresh rate ensures a pleasant viewing experience. Affordable Price: The Redmi Pad SE won't break the bank. At around $240 for the 128GB/8GB model, it's easy on your wallet. Plus, you get three color options: Mint Green, Graphite Gray, and Lavender Purple. Of course, there are some trade-offs: Graphics performance isn't mind-blowing. No official support for an active stylus. No fingerprint scanner.",5,Redmi Pad SE
Net Solution,7/28/2024,"Pour le prix je ne pense pas que l'on pourrait faire mieux. It is assez réactive, intègre 256Go de stockage. Pour les enfants c'est largement suffisant. It is also a beautiful one.|",5,Redmi Pad SE
denis,7/1/2024,"I have a tablet to navigate your internet and to save the post, I will say that it is not satisfactory. This film in streaming is ottimi and the audio is ok. Best traveling companion. A little scarso il riconoscimento facciale per sbloccarlo. At the end I must always insert the PIN.|",5,Redmi Pad SE
Jesus p.,8/28/2024,"High-end features, price. Look no further, recommended ??|",5,Redmi Pad SE
Zherlitsyna Svitlana,12/29/2024,"Tolles Tablet, my Tochter ist zufrieden damit.|",5,Redmi Pad SE
The|The,1/13/2025,"This tablet is perfect, the battery lasts days, it's fast, fantastic!|",5,Redmi Pad SE
Anonymous,11/13/2024,For this price I think this is the best tab available,5,Redmi Pad SE
Antonio Anmu,8/5/2024,Very good image quality and fluidity. Very good quality-price ratio.|,5,Redmi Pad SE
Samia S.,11/11/2024,Thank you I love it,5,Redmi Pad SE
Jean Paul,6/3/2024,Excellent rapport quality prix|,5,Redmi Pad SE
Mario,11/13/2024,Soddisfattissimo dell'acquisto. I use it mainly for work when I am traveling and I must say that my trovo benissimo and that it has been opened to my aspettative mie.|,5,Redmi Pad SE
moik,11/14/2024,Good price and good aspects,5,Redmi Pad SE
Amjad Ali,12/15/2024,I am very happy to buy this tablet at this price. very fast and good design. 10* for the product.,5,Redmi Pad SE
Aline|Aline,1/20/2025,"Chegou very well packaged and with a tax note. Fast delivery, chegou before the deadline. The tablet is perfect. Fluid, very armazenamento, I haven't used it for a few days, the battery lasts for 3 days of use, very good processor. Xiaomi always delivers cost and benefits, a tablet from the ""entry"" is better than those who are considered ""intermediaries"".|",5,Redmi Pad SE
Max,7/4/2024,Rapporto top quality. I was truly surprised by the potential of this Tablet...|,5,Redmi Pad SE
Israa bream,12/18/2024,Good memories. Good details..this review after 2 months of buying it...,4,Redmi Pad SE
ANDRE|ANDRE,11/8/2024,"|The video showcases the product in use.|The video guides you through product setup.|The video compares multiple products.|The video shows the product being unpacked.|Video Player is loading.||Play Video||Play||Mute||Current Time|0:00|/|Duration|1:15|Loaded: 8.01%|Loaded|8.01%|Stream Type||Seek to live, currently behind live|LIVE|Remaining Time|-|1:15||Playback Rate||Chapters||Descriptions|descriptions off|, selected||Captions|captions off|, selected||Audio Track|default|, selected||Fullscreen|A tablet, basic but fast. Vale seu valor. Eu, I knew I was smaller, but I was surprised by its size. Buy to read, but give to do much more. It uses 5G Wi-Fi, there is no slot for the network chip, and there is only one memory card input for up to 1 tera. An excellent tablet for studying and working. Your android is fluid and fast, great cost and benefit.|",5,Redmi Pad SE
sp,10/3/2024,Nickel tablet|,4,Redmi Pad SE
????????? ???????,11/13/2024,???? ?? ?????? ?????? ??????? ????|,4,Redmi Pad SE
Torg|Torg,6/3/2024,"Ich habe mir verschieden Tablets angeschaut.1. Lincplus T32. Xiaomi Redmi Pab SE3. Doogee T30 ProIch habe bisher das Medapad M5 lite LTE von Huawei seit Ende 2019. Leider fängt der Akku inzwischen zu schwächeln und Arbeitsspeicher, CPU und OS sind mitlerweile doch out. Da musste was neues her.Das Lincplus günstig mit 116,-€ aber Lautsprecher mies, Bild zu dunkel und keine Hoffnung auf Firmware Updates. Ging dann umgehend zuück.Das Redmi Pad hat sich gleich auf Android 14 upgedatet. Laut Website gibt es updates bis September 2026. Mit 8GB Ram und 256GB speicher auch für die nächste Zeit wohl ausreichend. Die CPU ist für mich vermutlich ausreichend schnell. Manchmal scheint das scrollen zu stocken, aber das kann auch an dem sehr glatten touch liegen. Der Sound wird mit dolby Atmos und Loudnes Funktion beworben. Besser wird es mit dem eingbauten Equalizer oder mit wavelet.Das Tablet ist sehr handlich aber ein bißchen eckig. 2 oder 3 Seiten der Einstellungen werden nur im Porträt-Modus angezeigt. Es kommt ohne Mobilfunk und erstaunlicherweise ohne Vibrationsmotor. Google Apps wie youtube, Google TV, Google Meet, Google One etc lassen weder deinstallieren noch deaktivieren. Wer es braucht ok, aber mich stört es wenn bei app updates diese dann angezeigt werden.Das Bild ist hell und die Farben ok aber nicht großartig unterschiedlich zum Doogee.Das Doogee macht einen guten Eindruck. Es ist wirklich sehr schnell und alle unerwünschten Google Apps lassen sich deaktivieren. Leider hat sich die Firmware nicht wie erwartet auf Android 14 aktualisiert. Mit der Anfrage an den Doogee Support bekam ich einen link zum Download der 14er Android Version (siehe Screenshots). Die beigefügte Anleitung ist nicht ganz klar, aber man kann sich das erarbeiten. Trotz der beworbenen Hifi Lautsprecher ist der der Klang blechern und auch mit den zwei Einstellungen zur Klangverbesserung nicht berauschend. Mit der App Wavelet (Equalizer) läßt sich das gröbste dann beheben. Die beigelegte Hülle stinkt leider stark. Beim ersten vollständigen Aufladen werden 100% angezeigt, wenn der Akku laut Accubattery app 6550 mAh anzeigt. Das Laden geht dann noch langsam weiter. Ich habe dann bei 7200 mAh Anzeige das Laden gestoppt. Angegeben sind 8500mAh. Das könnte sich mit mehrmaligen Laden noch verbessern.Das Bild ist bei normalen Gebrauch Innen hell genug. Die Farben lassen über 15 Stufen von warm nach kalt einstellen. Die automatische Helligkeit ragiert etwas sprunghaft. Das Tablet wird mitsammt der Hülle doch etwas schwer mit einer Hand zu halten.Ich häte nicht gedacht dass mir die Wahl eines neuen Tablets schwer fällt.Highlights are for Websurfen, Music videos and Prime Videos. Beruflich bedingt bin ich viel im Hotel und nicht überall kann an einen Firestick anschließen, daher ist mir ein guter Klang wichtig. Mein Mediapad hat ohne Klangeinstellung einen wesentlich bebesseren Klang (beworben mit Harman-Kardon), also fehlt mir zum schnellen Aufwecken bei allen Geräten ein Fingerabdrucksensor. Das M5 lite hat damals mit lte €229 gekostet und ich würde es mir mit etwas mehr Leistung und Speicher sofort wieder kaufen.|",4,Redmi Pad SE
Fany V.,9/9/2024,Product as advertised. For the moment it works perfectly.|,5,Redmi Pad SE
Zeeshan a.,1/6/2025,I received this yesterday Amazing experience with Amazon delivery on time and same as I ordered,4,Redmi Pad SE
"Three well into the debut, but the récipients explode and all are ready to leave three cafetières that are clear.",1/13/2025,impossible to connect to the internet|,1,Redmi Pad SE
?????,11/29/2024,???? ??? ????? ?????? ??? ?? ????? ?????|,5,Redmi Pad SE
Believ3r,6/26/2024,"Stupito give the technical capacity of this tablet. Veloce, affidabile, ottimo sia per lavoro che per giocare. Large, small and clearly defined display. 4 stars are not supported by HyperOS (the new MIUI) which causes limitations in the options and does not maintain the layout of the icon by changing the pattern of the screen. Risolto holding the system launcher with that of Microsoft.|",4,Redmi Pad SE
Mai A.,7/4/2024,?????? ???? ? ?? ????? ?????? ??? ??????? ??????.|,5,Redmi Pad SE
Paulo,1/12/2025,"The product meets expectations and delivers as promised. Sometimes the response to the touch-screen is a little slow, perhaps due to the projective film.|",4,Redmi Pad SE
Fernando Perez Iglesias,1/8/2025,"The Redmi Pad SE is a decent mid-range tablet for someone who isn't too demanding. It has a 2.4 GHz Snapdragon, 8 GB of RAM and 256 GB of internal memory. It has 4 side speakers with Dolby DTS and sounds really good. The screen is an 11"" Full HD + which lacks a little verve and sharpness. That's where the price cut is noticeable. Not only in the 2000x1200 resolution but also in that it is not as sharp or vibrant as the Lenovo or Samsung. In other respects it performs quite well, internet browsing, movies, average games, doing most tasks quite quickly. At the price it is, I recommend it for simple tasks like I use it but yes, the 8GB of Ram.|",4,Redmi Pad SE
mm,10/30/2024,"Cant get better in this price range, really good quality",5,Redmi Pad SE
Abdullah,11/30/2024,???? ?????? ??? ??? ????? ??? ???? ????? ????|,5,Redmi Pad SE
o. moh.,10/20/2024,Tap performance is perfect relative to its price.,5,Redmi Pad SE
Carlos Carvalho,9/6/2024,"Delivery within the deadline, it does not come packaged with the Amazon box or is shipped sealed with the Readmit box but checked in perfect conditions, or you may have tested (I received the leaf or product) for the price and the quality, YouTube video with excellent image, great, fast, have me Get used to Android 14 because everyone you have is Apple IOS. To be at home for support or for students, it is an excellent product with very good quality versus price.|",5,Redmi Pad SE
Taha Ghaedi,9/19/2024,Good,5,Redmi Pad SE
Francesco,12/19/2024,everything is fine|,5,Redmi Pad SE
Fernanda Ferreira Silveira|Fernanda Ferreira Silveira,2/9/2024,"|The video showcases the product in use.|The video guides you through product setup.|The video compares multiple products.|The video shows the product being unpackaged.|Video Player is loading.||Play Video||Play||Mute||Current Time|0:00|/|Duration|0:29|Loaded : 20.71%|Loaded|20.71%|Stream Type||Seek to live, currently behind live|LIVE|Remaining Time|-|0:29||Playback Rate||Chapters||Descriptions|descriptions off|, selected||Captions|captions off|, selected||Audio Track|default|, selected||Fullscreen|Everything is correct, I ordered on 01/08, it was sent on 01/16, it arrived on 02/09. It was taxed at around 50 reais and the tax was paid within 4 days after the seller was informed. Veio global carrier (or that it was a my receipt, which did not include the Chinese version). Sensational value of 1,549 still possible to do semi-finished parcels! A tablet very well in metal, as in reference to the fact that it has 8 gb of ram and 256 gb armanezamemto então ele é potento rolls smoothly from day to day and is shown very well in games (as shown in the video, it has Honor and is considerably ""heavy""). I managed to easily transfer my data from the iPhone to it with the help of the iPhone itself. The seller is very attentive and has received a lot of attention, the only point that can be negative is that we only see the product's own box inside a bag, or that it can cause some inconvenience not to move… the front camera is silent, or that I had not expected Because it is 5MP, the rear of 8MP is very satisfactory. But it is a common feature on tablets as cameras we should leave behind. Resolução da fabric e brilho achei bem bons. Or som really face jus years compliments clean and high.|",5,Redmi Pad SE
Amazon Customer,9/16/2024,"Excellent tablet, average value. Maybe too big for simpler uses, but better quality.|",5,Redmi Pad SE
Werner Kulisch,10/16/2024,Genau das was ich brauche. Lange Akkuleistung|,5,Redmi Pad SE
Pretty|Bonito,11/29/2024,"Wonderful tablet, super fast and strong. Also very nice. The shipping was super fast, only the seller should send by other means, the mails are a porcaria, I did not buy with delivery data .|",5,Redmi Pad SE
Sultan Al-Muhazimah,7/27/2024,????? ???? ??????? 698 ????|,5,Redmi Pad SE
saeed hadi,8/13/2024,?? ???? ??????? ???? ????????? ?? ????????|,5,Redmi Pad SE
Doruk,8/21/2024,Posso scaricare so many giochi e fare editing video fluidi|,5,Redmi Pad SE
Mohamed Mamdouh,10/2/2024,Amazing device but I heard updating it makes it slower so I recommend not updating it.,5,Redmi Pad SE
Bruno,1/15/2025,"I have been using it for work and personal use, just a week and that moment has been very good, excellent quality of image, of sound. Please inquire carefully before purchasing, the delivery of the new product in a week for SP and the shipment in a plastic bag, all well packaged.|",5,Redmi Pad SE
Practice the face that is described in the description of the product. Ponta macia que no ristavtrla. Please note that it is not compatible with a Samsung Galaxy tablet.|Practice the face that is described in the description of the product. Ponta macia que no ristavtrla. Please note that it is not compatible with a Samsung Galaxy tablet.,1/3/2025,"I use various brand products such as smartwatch, smartphone, smart lamp and agora or Pad SE. It's hard to understand the reliability that I have in the brand that has several smartphones from the manufacturer and I have never regretted it. 100% reliable product. Charge the battery very quickly, have an optimal response to the dice processing image.|",5,Redmi Pad SE
Vitor|Vitor,12/11/2024,"Essa sem duvidas is a better purchase and investment than ever before in my life! The tablet is perfect with super high quality and very good battery durability as well as very large itself. The first time you are impressed, it is not very good, and you have downloaded a film to assist in streaming in “off-line” mode and it simply loses all the quality because when you watch “online” series and films with quality wi-fi excellent I thought a thousand things achei até que estivesse com problema mas pra mim é super From now on, there is no catch in anything that continues, great!!|",5,Redmi Pad SE
Very good,1/21/2025,Atendeu exceeds expectations given its benefits.|,5,Redmi Pad SE
John B.,1/17/2025,"Good and cheap, worth it.|",5,Redmi Pad SE
Thiago Rocha|Thiago rocha,1/8/2025,"Received! Product intact, very fast delivery and already configured for my use. Seller helped me at all times, from purchase to receipt. Note 1000!!!|",5,Redmi Pad SE
Gabriel Lourenço,1/10/2025,"Great product for work, study and editing documents! I can buy without being happy!|",5,Redmi Pad SE
Ricardo Victor,1/8/2025,"Adorei esse tablet, simply fantastic. Take care of all your needs. Chegou doesn't pray.|",5,Redmi Pad SE
Daniel,1/10/2025,"Fast delivery, everything perfect, product meets all expectations!!!|",5,Redmi Pad SE
Vivian,1/4/2025,"I was surprised to respond to the touch, bigger than I imagined and super light. Let's see how its efficiency lasts.|",5,Redmi Pad SE
Very Good,1/15/2025,Great product|,5,Redmi Pad SE
Jacqueline Komka|Jacqueline Komka,12/27/2024,"Cara, eu fiz or order in two days. It was marking to check out on January 3rd. E chegou leaf!! I am very happy, the product is of excellent quality! 256GB of internal memory, except 8GB of RAM. You are thinking about buying, don't change your mind, it is really worth it.|",5,Redmi Pad SE
Products of Roça,1/6/2025,"Product is excellent, just do not buy a capinha and face missing, so buy and buy together to protect. Prodo better than propaganda|",5,Redmi Pad SE
Peter,12/28/2024,"The tablet is excellent, both its system and its physical characteristics, it is worth a lot and its quality is above two tablets for that price. The service was super calm, the tablet checked before the scheduled date.|",5,Redmi Pad SE
Papa Fox,12/20/2024,"Normally done as validation months after use. That's the case. Product has been packaged. Tem quality. Fair price. Fast delivery in my possession. Xiaomi beats Samsung and Apple in the past few years, but few enxergam isso. You are a user of two products from 3 companies and when you want a good hardware with a fair price you don't need to think twice: buy Xiaomi.|",5,Redmi Pad SE
Luis Antonio,1/5/2025,Deliver everything or promise. I recommend|,5,Redmi Pad SE
Jane,12/31/2024,"I found out that the device has a very good image, or the best tablet that I have ever purchased.|",5,Redmi Pad SE
July,12/28/2024,Excellent product and beats many more renowned competitors. Minha filha amou or present.|,5,Redmi Pad SE
Chegou before the deadline and works very well.,12/25/2024,Chegou before the deadline and works very well.|,5,Redmi Pad SE
Rosana Aggio,12/30/2024,Great product... Packed well.|,5,Redmi Pad SE
GREAT,12/26/2024,I only read books nele??|,5,Redmi Pad SE
Wesley,12/17/2024,"The tablet is very good, fast, and has an ideal size. Gostei muito. Delivery was very fast too, check before the deadline.|",5,Redmi Pad SE
Thax,1/13/2025,"The tablet is excellent for studying. What you decided to leave was the delivery that will charge 50.00 for shipping and handling, to send by mail, and even after 20 days of delay, you have to open a claim with them, and only then will it be delivered.|",4,Redmi Pad SE
OD: The best work on the Midway Battle that marked the end of the Japanese offensive at the beginning of,1/13/2025,"Very good performance, but I confess that the product's appearance has a very different configuration from all the tablets that I have. You are trying to get a manual or a help site to see if you can extract all the benefits.|",4,Redmi Pad SE
Michelly,12/12/2024,"Very good, chegou no verzo, beautiful designer, size very good and it will be useful for what I need, I recommend!!|",5,Redmi Pad SE
Edilrene,12/17/2024,"The product is of good quality. I saw it within the deadline, and it was very well packaged. I recommend or seller.|",5,Redmi Pad SE
Joao Leite de Santana,12/24/2024,Very good product|,5,Redmi Pad SE
Elaine|Elaine,12/23/2024,Great product!|,5,Redmi Pad SE
Milton Nogueira Candido,12/13/2024,"The last product, it is only chatted that we do not see the charger, so it is not very clear or advertised. But fora it is super fast delivery, product sealed in the box.|",5,Redmi Pad SE
BruceBatMan,12/6/2024,"Aside from simply browsing the internet and checking email etc, which every tablet should be able to do, there are two main reasons to get this tablet IMHO.It excels at drawing.  It's been a while since I've looked into drawing tablets - back in the day if you wanted a good tablet for drawing you got a mid screen and all it did was draw.  No internet, nothing.  This is a full fat tablet (that basically does the role of a desktop or laptop for your average user) and it has a great pen experience.  I've been drawing with krita, which is a very feature dense program and there is no lag.The other thing it does great is media.  The screen is awesome and the speakers are surprisingly loud.  Because it's in the android ecosystem you can run Firefox as your browser and get ublock origin meaning you never have to see ads as long as you're using Firefox (notably for YouTube). The tablet also natively will keep playing YouTube when you turn off the screen.  Or at least it does with Firefox - never had any desire to download the app, frankly.  The screen is big enough to be a significant improvement over even a large phone. But not so big that it feels hard to be portable.The other half of media is games.  Obviously this is not a gaming PC.  It's not going to run any real heavy duty games.  But if you want it for mobile games especially card games like slay the spire, legends of runeterra, or hearthstone, then this is just basically the perfect device for them.  The screen has great color and contrast, so since graphical fidelity is not the limiter with these, they can actually look better on this than a PC because the screen is great.  It's also basically the perfect size for card games.  Large enough to feel like the full primo experience, but small enough you don't feel like you are dragging your finger across miles of realestate for every action.Seems the one place that isn't amazing is the battery.  The battery is fine.  It's not bad, it's not great.  It will last you long enough, but it's not going to knock your socks off.Unless you have a really specific reason that you absolutely NEED a larger screen or something, I can't really imagine recommending a different tablet at the moment.",5,Galaxy Tab S6 Lite
AnotherUser,8/25/2024,"Bought this on discount.  Definitely worth the price at the point.  With the S-Pen and the good usability of the tablet, I find it very useful for browsing and doing minor edits in Google Docs, etc.  The battery life is pretty decent, and the screen and sound is pretty good for watching videos.  Better than the Kindle 10 fire.So if you only want to watch videos / browse and not do much else, buying a Kindle 10 Fire on discount is probably a better deal.  Though if you want to do more productivity stuff, the S-Pen that comes with it is very handy.  There are plenty of affordable and sturdy cases for this device that will also hold the pen.In terms of speed, it works fine.  But if you've used an iPad Pro, you will notice it has more of a lag when loading new web pages.  Not enough to matter, but to be noted if you're used to the rapid loading speeds. Upon initial device setup, there's a lot of software updates, etc. which makes the lag more noticeable until they're all done.Finally, you can also consider the Samsung FE tablet, which is more premium table for more money.  I ended up sticking with this one, not because of the price, but because that one is about 20% heavier, and this lightweight tablet made it so easy to carry and use.  Also, there are sometimes trade programs to get the FE tablet.  If you use this one for a few years, then pay a little bit to get more for a new FE tablet, then it's an even better deal.  But you can't go wrong with the FE tablet now too if you're in the market for a more powerful device.",5,Galaxy Tab S6 Lite
PD,1/20/2025,"I have been using the Samsung Galaxy Tab S6 Lite (2024) for several months. It was easy to transfer information from my Samsung phone to the tablet - even for someone in her 70s. In a short amount of time, I transferred all my favorite apps and pictures. I have a laptop but the tablet is lighter in weight and easier to use on the go or when watching TV. The memory is adequate for my needs and I especially like the stylus. The tablet charges in a short amount of time and I have no complaints about the length of the charge. The speed and clarity are great.",5,Galaxy Tab S6 Lite
Charles Childers,5/20/2024,"I have this as a secondary tablet, alongside an M1 iPad Pro 11"".The Tab S6 Lite is no where near as powerful, but that's ok. It's still a quite usable tablet, with solid construction and good battery life.My main use cases: taking notes with Samsung Notes, reading books (FBReader, Bible Study by Olive Tree), playing games (nothing demanding, mostly Stardew Valley, Another Eden, and some emulation of older consoles), programming (under Termux), music (YT Music) and audio books (Audible). All of these work well on it. It takes a little longer to start some of the games than my iPad, but they run fine once loaded. It's not great for multitasking. I've found that using two apps in split screen is ok. It feels a bit sluggish with three on screen. When running larger games it'll have to restart apps when switching. None of this is problematic for me, but it's worth noting.Battery life has been good so far. On my longest day with it I started using it about 10 AM, and plugged it in at 11 PM with 29% remaining battery. During that time I only had the screen off for two hours, and it was otherwise in continual use. (I run about 25-30% brightness). About half of that time was spent reading, and the rest was a mix of playing Stardew Valley, taking notes, and programming under Termux.Notetaking is pretty nice. The included S Pen works well, and attaches magnetically to the top. It does not need charging, so is always ready to use. My son (more artistically inclined than I) says it's not as good at pressure sensitivity as the Apple Pencil, but he had no complaints with the feel or accuracy.The build quality is fine. The tablet is a little heavy, but feels solid. It's a touch more slippery than I'd like, but this hasn't actually been a problem. I have no other complaints on this.The display is a bit of a let down. The resolution is fine, but there's a bit of backlight bleed along the edge with the USB C port. It also has a lot of glare. I can mostly ignore these, but they are sometimes a bit problematic.",4,Galaxy Tab S6 Lite
